{
  "$schema": "https://github.com/wmakiela-tech/Nash-iw-research/blob/main/schemas/research-reproduction-manifest.schema.json",
  "manifest_id": "IW_SW_QUANTUM_PROCESS_REPRO_MANIFEST_001_20261017",
  "artifact_id": "IW_SW_QUANTUM_PROCESS_EXACT_WITNESSES_REPORT_001_20261017",
  "title": "Exact finite-dimensional quantum-process checks",
  "origin_cell": "IW_SCIENCE_WORK_01 / SW",
  "created_at": "2026-10-17T00:27:44Z",
  "as_of": "2026-10-17",
  "task_id": "LT4-MONOGRAPH-CH5-QUANTUM-PROCESS-MEMORY-SUPERMAP-REVIEW-001_20261013",
  "exposure": "PUBLIC",
  "status": "FROZEN",
  "claim": {
    "question": "Do the concrete finite-dimensional witnesses obey the declared instrument, Choi and comb conventions?",
    "object": "Two qubits, fixed product environment, controlled Pauli gates, unnormalized Choi operators and fixed-order two-slot combs",
    "statement": "28 exact checks pass, including order, transpose and comb-normalization negative controls; the analytic projector argument embeds the semigroup failure in an autonomous unitary group.",
    "claim_ceiling": "Concrete exact identities and elementary analytic proofs; no novelty, generic supermap realization, specifically quantum memory, gravity or physical stability claim"
  },
  "code": {
    "repository": "https://github.com/wmakiela-tech/Nash-iw-research",
    "commit": "CONTENT_SHA256:1571f87c2583fe1bc913dcb90ff7cd31aa849c7d4e10d3744606ec3a99393b91; containing commit recorded by publication receipt",
    "entrypoint": "runtime/sw/2026-10-17/exact_quantum_process_checks.py",
    "license": "Original verification code with Python standard-library dependencies; no separate license grant asserted"
  },
  "environment": {
    "os": "Linux",
    "architecture": "x86_64",
    "runtime": "CPython 3.12.14",
    "dependency_lock": "Python standard library only; no third-party runtime dependency",
    "hardware": "Single CPU; no GPU, nondeterministic arithmetic or hardware-sensitive tolerance"
  },
  "execution": {
    "clean_start": "Checkout the immutable publication commit from its receipt; start at repository root with Python >=3.10. All fixtures are literal rational matrices in the script.",
    "commands": [
      "python3 runtime/sw/2026-10-17/exact_quantum_process_checks.py --output /tmp/sw_quantum_process_results.json"
    ],
    "parameters": {
      "dimensions": [
        2,
        2
      ],
      "choi_normalization": "unnormalized",
      "comb_order": [
        "o1",
        "i1",
        "o0",
        "i0"
      ]
    },
    "seeds": [],
    "tolerances": {
      "arithmetic": "exact Q(i)",
      "equality": "zero discrepancy"
    },
    "stop_rule": "Raise AssertionError and exit nonzero at the first failed check; otherwise emit 28 PASS checks.",
    "expected_runtime": "Less than one second in the author run; runtime is not part of the scientific claim"
  },
  "inputs": [
    {
      "path": "runtime/sw/2026-10-17/exact_quantum_process_checks.py",
      "sha256": "1571f87c2583fe1bc913dcb90ff7cd31aa849c7d4e10d3744606ec3a99393b91",
      "source": "Embedded exact rational fixtures constructed for these calculations",
      "schema": "Python source with Q(i) scalars and explicit tensor dimensions",
      "units_or_conventions": "hbar=1; time unit=1; S,E order; Choi output,input order; unnormalized comb",
      "exposure": "PUBLIC"
    }
  ],
  "outputs": [
    {
      "path": "research/sw/2026-10-17/IW_SW_QUANTUM_PROCESS_EXACT_WITNESSES_REPORT_001_20261017.md",
      "sha256": "718196e3569f24ab65704033b49128e5151d63812380dcdb9ba125bf8a06e2e2",
      "role": "OTHER",
      "derived_from": [
        "Analytic derivation and the primary sources identified in the report"
      ],
      "expected": "Companion authored scientific or source-verification record, not automatically generated by the checking script"
    },
    {
      "path": "research/sw/2026-10-17/exact_quantum_process_results.json",
      "sha256": "6704886eaafa466b883f6b60b4027c3d31ef0a3c48d6f32f20759bfa10ec4d63",
      "role": "DERIVED",
      "derived_from": [
        "runtime/sw/2026-10-17/exact_quantum_process_checks.py"
      ],
      "expected": "status PASS; 28 checks; determinant -2; negative eigenvalues -1 and -1/2; comb trace 4; intervention TV 1"
    },
    {
      "path": "research/sw/2026-10-17/quantum_process_references.bib",
      "sha256": "2d456e421beb9f44d4a1277352fb74bf21478a24ac1bc706633ead8f509272c8",
      "role": "OTHER",
      "derived_from": [
        "Analytic derivation and the primary sources identified in the report"
      ],
      "expected": "Companion authored scientific or source-verification record, not automatically generated by the checking script"
    },
    {
      "path": "research/sw/2026-10-17/quantum_process_source_verification.json",
      "sha256": "816f11bc6b4835941fe4a84b1b095ec745a5986c5da535efcbfdc909459c27f6",
      "role": "OTHER",
      "derived_from": [
        "Analytic derivation and the primary sources identified in the report"
      ],
      "expected": "Companion authored scientific or source-verification record, not automatically generated by the checking script"
    }
  ],
  "verification": {
    "tests": [
      "controlled_gates_and_swap_unitary",
      "autonomous_group_projector_identity",
      "autonomous_group_endpoint_phase_minus_one",
      "one_step_channel_on_all_matrix_units",
      "two_retained_steps_are_identity_on_all_matrix_units",
      "refreshed_channel_is_idempotent_on_all_matrix_units",
      "semigroup_failure_witness",
      "history_retained",
      "history_refreshed",
      "history_normalization",
      "negative_control_instrument_order_detected",
      "choi_reconstruction_including_imaginary_coherence",
      "negative_control_missing_transpose_detected",
      "choi_trace_preserving",
      "transpose_choi_is_swap",
      "transpose_exact_negative_eigenvector",
      "bell_partial_transpose_negative_half",
      "four_density_operators_span",
      "linear_relation_failure_detected",
      "comb_first_causality",
      "comb_second_causality",
      "comb_unnormalized_trace",
      "comb_spectral_polynomials",
      "negative_control_trace_one_comb_detected",
      "swap_transfers_arbitrary_input_on_all_matrix_units",
      "identical_endpoint_channels_on_all_matrix_units",
      "intervention_output_formula_on_all_matrix_units",
      "perfect_intervention_distinguishability"
    ],
    "controls": [
      "Instrument moved before first gate changes history",
      "Missing Choi transpose changes the +i projector",
      "Trace-one normalization breaks comb causality",
      "Legal-state interpolation forces a non-CP transpose"
    ],
    "warnings": [
      "General theorems are proved analytically or cited; finite checks do not establish a universal realization theorem."
    ],
    "known_failures": [],
    "reproduction_status": "AUTHOR_REPRODUCED",
    "independent_reproducer": "NOT_PERFORMED; no separate participant or blind review in this rotation",
    "platform_deviations": [
      "The python_version metadata field can differ across runtimes; exact mathematical fields must agree."
    ]
  },
  "provenance": {
    "primary_location": "research/sw/2026-10-17/IW_SW_QUANTUM_PROCESS_EXACT_WITNESSES_REPORT_001_20261017.md",
    "content_sha256": "718196e3569f24ab65704033b49128e5151d63812380dcdb9ba125bf8a06e2e2",
    "narrative_artifact": "IW_SW_QUANTUM_PROCESS_EXACT_WITNESSES_REPORT_001_20261017",
    "derived_from": [
      "MT13-BOOK-ROT22-CH5-INTERVENTION-COMPLETE-TWO-ENDPOINT-NONIDENTIFIABILITY-001_20261014",
      "Watrous2018TQI",
      "Chiribella2009Networks",
      "Pollock2018Markov"
    ],
    "supersedes": [],
    "stale_if": "Any preparation, basis, tensor order, gate, convention or process-class change; check source changes before reuse.",
    "readback_state": "NOT_VERIFIED",
    "delivery_state": "NOT_ROUTED"
  }
}
